"ID","FOURNISSEUR_NOM","FOURNISSEUR_REFERENCE","SizesColors","DATE_CREATION","Title","Image","Description","Category","Subcategory","SubSubcategory"
c88c6f27-3f52-4415-a0a7-fee5f125ab13,A10,22.052610,"L/MULTICAM, L/NOIR, L/TAN, M/MULTICAM, M/NOIR, M/TAN, S/MULTICAM, S/NOIR, S/TAN, XL/MULTICAM, XL/NOIR, XL/TAN, XXL/MULTICAM, XXL/NOIR, XXL/TAN",06/09/2022,Gants Mechanix M-Pact,https://www.vsmdiffusion.fr/2869-large_default/mitaines-mechanix-m-pact-noir.jpg,"Caractéristiques : CONCUS POUR : ARMEES - FORCES DE L'ORDRE - MANUTENTION  - L'Impact Guard ™ et sa mousse de protection EVA protègent les articulations - Le TPR (caoutchouc thermo-plastique) renforce la protection au niveau des articulations et des doigts - Le matériau TrekDry® moulant permet de garder les mains au sec et apporte un confort dans l'utilisation - Renfort par double épaisseur de matière au bout des doigts - Grip au pouce et à l'index - Mousse absorbante aux chocs au niveau de la paume - Absorption renforcée par procédé XRD® au niveau de la paume - Paume synthétique renforcée - Fermeture en TPR (caoutchouc thermo-plastique) pour un bon ajustement au poignet - Crochet d'attache - Lavable à 30°C  CERTIFICATIONS : 3121 EN388 / EN420 Tailles : S,M, L, XL ou XXL Coloris : Noir, Tan ou Multicam",Accessoires,Gants,
20adac0a-b405-41ee-ba08-45b85cfc05fc,A10,22.052605,"L/MULTICAM, L/NOIR, L/TAN, M/MULTICAM, M/NOIR, M/TAN, S/MULTICAM, S/NOIR, S/TAN, XL/MULTICAM, XL/NOIR, XL/TAN, XXL/MULTICAM, XXL/NOIR, XXL/TAN",09/09/2022,Gants Mechanix original,https://www.vsmdiffusion.fr/7459-large_default/gants-mechanix-original.jpg,"Caractéristiques : CONCUS POUR : ARMEES - FORCES DE L'ORDRE - TIR SPORTIF - MANUTENTION  - En stretch Spandex - Bandes de renfort dans la zone à forte usure - Paume sans couture pour un bon ajustement et une meilleure dextérité - Fermeture en TPR (caoutchouc thermo-plastique) pour un bon ajustement au poignet - Crochet d'attache - Lavable à 30°C  CERTIFICATIONS : 3121 EN388 / EN420 Tailles : S,M, L, XL ou XXL Coloris : Noir, Tan ou Multicam",Accessoires,Gants,
be555cc6-b90a-4883-9c50-d72bab26747c,A10,01.097253,"L/NOIR, M/NOIR, S/NOIR, XL/NOIR, XXL/NOIR",29/09/2022,Gants Thermo Performer niveau 3 noir,https://www.vsmdiffusion.fr/4577-large_default/gants-touch.jpg,"La gamme Thermo Performer, issue des dernières technologies, offre une régulation de la température corporelle et une évacuation de la transpiration optimales dans les conditions les plus extrêmes. Les matières utilisées sont légères, résistantes et confortables. Les différents niveaux étudiés de protection thermique répondent à tout besoin sur le terrain. Propriétés spécifiques de la gamme Thermo Performer : - Thermorégulation - Evacuation rapide de la transpiration - Coupe ergonomique pour un confort maximal  Caractéristiques : 100% polyester « Touch Screen » au pouce et à l'index Lavage à 30° Tailles : S à XXL",Accessoires,Gants,
8f96ed59-8c0f-411d-a6bc-7289353e3d33,A10,01.097252,"L/NOIR, M/NOIR, S/NOIR, XL/NOIR, XXL/NOIR",29/09/2022,Gants Thermo Performer niveau 2 noir,https://www.vsmdiffusion.fr/4574-large_default/gants-touch.jpg,"La gamme Thermo Performer, issue des dernières technologies, offre une régulation de la température corporelle et une évacuation de la transpiration optimales dans les conditions les plus extrêmes. Les matières utilisées sont légères, résistantes et confortables. Les différents niveaux étudiés de protection thermique répondent à tout besoin sur le terrain. Propriétés spécifiques de la gamme Thermo Performer : - Thermorégulation - Evacuation rapide de la transpiration - Coupe ergonomique pour un confort maximal  Caractéristiques : 100% polyester « Touch Screen » au pouce et à l'index Lavage à 30° Tailles : S à XXL",Accessoires,Gants,
3048dd5d-3bb4-443d-a2e9-3020750512b7,A10,01.097251,"L/NOIR, M/NOIR, S/NOIR, XL/NOIR, XXL/NOIR",29/09/2022,Gants Thermo Performer niveau 1 noir,https://www.vsmdiffusion.fr/4571-large_default/gants-touch.jpg,"La gamme Thermo Performer, issue des dernières technologies, offre une régulation de la température corporelle et une évacuation de la transpiration optimales dans les conditions les plus extrêmes. Les matières utilisées sont légères, résistantes et confortables. Les différents niveaux étudiés de protection thermique répondent à tout besoin sur le terrain. Propriétés spécifiques de la gamme Thermo Performer : - Thermorégulation - Evacuation rapide de la transpiration - Coupe ergonomique pour un confort maximal  Caractéristiques : 100% polyester « Touch Screen » au pouce et à l'index Lavage à 30° Tailles : S à XXL",Accessoires,Gants,
ccd4e77f-6cd7-44ff-a193-a65150b0a7db,HELIKON-TEX,RK-TKO-RP,"L/KAKI, L/NOIR, M/KAKI, M/NOIR, S/KAKI, S/NOIR, XL/KAKI, XL/NOIR, XXL/KAKI, XXL/NOIR",10/11/2023,Trekker Outback Gloves,https://www.helikon-tex.com/media/catalog/product/cache/4/image/265x/9df78eab33525d08d6e5fb8d27136e95/r/k/rk-tko-rp-02.jpeg,,Accessoires,Gants,
b11373ca-1af3-43b9-ab31-dd4a2c8e2e12,A10,22.052613,"L/NOIR, L/TAN, M/NOIR, M/TAN, S/NOIR, S/TAN, XL/NOIR, XL/TAN, XXL/NOIR, XXL/TAN",06/09/2022,Gants Mechanix M-Pact 3,https://www.vsmdiffusion.fr/2876-large_default/mitaines-mechanix-m-pact-noir.jpg,"Gants d'intervention coqués conçus pour les Armées et les Forces de l'OrdreCaractéristiques : Dessus en tissu respirant TrekDry® pour le maintien des mains au frais et au sec avec coque en caoutchouc thermo-plastique et renforts matelassés EVA pour la protection des articulations et des phalanges Dessous en microfibre renforcée avec partie striée pour une meilleure adhérence et résistance à l'usure Coutures renforcées au niveau du pouce et de l'index avec extrémités striées pour une meilleure adhérence et résistance à l'usure Ajustement du gant par auto-agrippant au niveau du poignet Boucle en nylon pour le transport Certifications : CE 3121 EN 388 / EN 420 Lavage à 30° Tailles : S,M, L, XL ou XXL Coloris : Noir ou Tan",Accessoires,Gants,
c5586050-7128-492c-82aa-cc42244edeb0,TREESCO,PHMA002,"3XL/SNAKE, L/SNAKE, M/SNAKE, S/SNAKE, XL/SNAKE, XXL/SNAKE",09/11/2022,GANTS SNAKE,https://www.vsmdiffusion.fr/8138-large_default/gants-snake.jpg,Composition : 92 % polyester 8 % spandex. Caractéristiques : Gants Softshell 3 couches. Ouverture pour doigt droitier. Tailles :   M au 2XL Coloris :  Snake Forest/Snake Orange,Accessoires,Gants,
3b68883b-5083-42ff-9946-9fe91c8e8f42,TREESCO,PHMA005,"3XL/SNAKE, L/SNAKE, M/SNAKE, S/SNAKE, XL/SNAKE, XXL/SNAKE",09/11/2022,GANTS FIN TACTILES,https://www.vsmdiffusion.fr/8143-large_default/gants-fin-tactiles.jpg,Composition : 100% polyester. Caractéristiques : Gant fin avec Index et pouce tactiles permettant la navigation sur les écrans de smartphone. Tailles :   S au 3XL Coloris :  Snake Orange/Snake Forest,Accessoires,Gants,
af366180-dacd-46ea-9833-9cccac063e92,TREESCO,PHGI006,"3XL/KAKI, 4XL/KAKI, L/KAKI, M/KAKI, S/KAKI, XL/KAKI, XXL/KAKI",05/11/2022,GILET ATTILA,https://www.vsmdiffusion.fr/10015-large_default/gilet-attila.jpg,"Composition : Gilet de traque 100% polyester avec enduction polyuréthane et tissu kaki sur les côtés en 65% polyester 35% coton, Doublure filet 100% polyester anti-transpiration.Empiècement renfort épaule en double épaisseur. 1 poche radio zippée à la poitrine, 2 poches repose-main, 2 poches zippées, 2 grandes poches basses à rabat avec cartouchières intégrées (5 balles et 6 cartouches). Poche poitrine zippée. 2 poches intérieures zippées et 1 poche téléphone. Système d'aération dos. Carnier zippé doublé.Caractéristiques :1 poche radio zippée à la poitrine, 2 poches repose-main, 2 poches zippées, 2 grandes poches basses à rabat avec cartouchières intégrées (5 balles et 6 cartouches). Poche poitrine zippée. 2 poches intérieures zippées et 1 poche téléphone. Système d'aération dos. Carnier zippé doublé. Tailles :  S au 4XL Coloris :  Vert et Orange",Vêtements,Hauts,Gilets
e77a415c-1e72-4b00-9b5e-a7bf40e53b25,TREESCO,1220N,"M/L, XL/XXL",09/11/2022,GILET traque sans bande réfléchissante,https://www.vsmdiffusion.fr/8778-large_default/gilet-traque-sans-bande-rflchissante.jpg,Composition : 100% polyester. Caractéristiques : Normé CE. Tailles :   M/LXL/XXL Coloris :  Orange,Vêtements,Hauts,Gilets
b8fb42f9-c610-4692-a9cd-a7a4b44c472e,TREESCO,PHPI001,,10/11/2022,GUETRE RHINO,https://www.vsmdiffusion.fr/8144-large_default/guetre-rhino.jpg,"Composition : 100 % Cordura Diamond 600 D très haute résistance. Membrane PU. Doublure polyester. Caractéristiques : Guêtre utra-résistantes. Cordon de serrage, sangle de caoutchouc renforcée avec double rivets.Crochet à lacet. Elastiques de maintien. Tailles :   Unique Coloris :  Vert",Autres,,
0b43c843-d5a8-4789-a892-2aa33e31362f,HIGHLANDER,TA153,,15/11/2023,Crusader Waterproof Hammock,https://cdn.shopify.com/s/files/1/0618/6264/1948/products/TA153-1.jpg?v=1668983781,"The Crusader Hammock has everything you need for a bug-free and comfortable night's sleep off the ground. With an integrated mosquito net and an elevated waterproof tarp, this durable hammock set offers protection from rain, insects, and other animals. You'll find many benefits to sleeping above the ground. Not only can you camp anywhere there are trees or high anchor points, staying off the ground helps you leave no trace on your environment. This hammock kit includes two strong lengths of webbing, two karabiner clips, guy ropes, and tough pegs.",Autres,,
add2a338-5f96-4ff2-bb09-0f7be806ac07,MP-SEC,SNU-HAMJUN,,16/11/2022,Hamac Jungle,https://www.catalogue.mp-sec.fr/media/catalog/product/cache/2/image/9df78eab33525d08d6e5fb8d27136e95/s/n/snu-hamjun-og-1-v2.jpg,"Hamac complet avec moustiquaire pour vous protéger des insectes piqueurs, il est livré avec tous les accessoires pour une mise en place facile et rapide.Fabrication en toile de parachute nylon renforcé par des triples coutures",Autres,,
8a6f5286-4db9-46f2-a7ce-86d108fe40cc,A10,41.201221,,01/12/2022,Holster inside cordura IA264 pour Glock,https://www.vsmdiffusion.fr/2842-large_default/holster-inside-cordura-ia2.jpg,"""HOLSTER INSIDE EN CORDURA® POUR LA DISCRÉTION"" Caractéristiques : Holster rigide pour une meilleure mise en place de l'armePatte de sécurité Convient pour: GLOCK 17/20/21/22/31/37H&K USP STANDARDSIG SAUER P220/226WALTHER P99",Autres,,
97953751-50e2-4e65-8e8b-685e65be04f1,A10,14.099260,,01/12/2022,Lampe frontale rechargeable HC3 - 100 Lumens,https://www.vsmdiffusion.fr/11970-large_default/lampe-frontale-rechargeable-hc3-100-lumens.jpg,"Compacte et légère, la lampe frontale HC3 de Klarus vous assure un grand confort d'utilisation. D'une puissance maximale 100 lumens, elle dispose d'une autonomie pouvant aller jusqu'à 36h Caractéristiques : Lampe frontale éclairage 2 couleurs rechargeable compacte et légère à tête pivotante jusqu'à 180°Distance d'éclairage maximale : 15 mIntensité lumineuse maximale : 100 lumensAutonomie minimale : 4 heuresAutonomie maximale : 36 heuresQuatre intensités lumineuses (6, 45 et 100 lm en éclairage blanc et 4 lm en éclairage rouge)Mode clignotant en éclairage rouge (4 lm)Résistance aux chutes : 2 m de hauteurÉtanchéité : norme IPX-5 (résistance aux projections des jets d'eau)Rechargement de la lampe par cordon USB non magnétique réf 99299 (fourni)Livrée avec une batterie rechargeable intégrée, un clip en plastique et un bandeau élastique ajustableGarantie : 1 an  Dimensions :  6,2 x 5 x 2,3 cm   Poids : 37 gr (avec batterie) Coloris :  Gris",Accessoires,,
dbbe2da0-fb82-4382-a683-172aa554508a,A10,14.099263,,06/01/2024,Lampe frontale HM2 - 270 Lumens,https://www.vsmdiffusion.fr/13339-large_default/lampe-frontale-hm2-270-lumens.jpg,"Caractéristiques : Lampe frontale compacte et légère à tête pivotante jusqu'à 60° avec crochet de suspension et sifflet d'alerteÉclairage deux couleurs : blanc et rougeSystème de détection intelligent : passez simplement votre main devant la lampe pour l'allumer ou l'éteindreDistance d'éclairage maximale : 81 mIntensité lumineuse maximale : 270 lumensAutonomie minimale : 5,5 heuresAutonomie maximale : 21 heuresCinq intensités lumineuses (30, 60, 100 et 270 lm en éclairage blanc et 3 lm en éclairage rouge)Mode clignotant en éclairage blanc et mode S.O.S. en éclairage rougeFabriquée en polymèreRésistance aux chutes : 1 m de hauteurÉtanchéité : norme IPX-4 (résistance aux intempéries)Alimentation par 3 piles LR03 - AAA (non fournies)Livrée avec un bandeau élastique ajustableGarantie : 1 an Dimensions : Longueur 6,6 cm x hauteur 4,5 cm x profondeur 3,7 cm Poids :Poids net : 40 g (sans pile)Poids brut : 75 g (avec piles) Coloris :  Noir",Accessoires,,
8543c997-a0e0-4db2-89d1-8fabba28bfec,A10,30.027151,,17/08/2023,Lampe frontale Hybrid éclairage 4 couleurs Aria 1 camo fr/ce - 350 Lumens,https://www.vsmdiffusion.fr/13178-large_default/lampe-frontale-hybrid-eclairage-4-couleurs-aria-1-camo-fr-ce-350-lumens.jpg,"Caractéristiques :Distance d'éclairage maximale : 70 mIntensité lumineuse maximale avec piles (fournies) : 350 lumensIntensité lumineuse maximale avec batterie (en option) : 450 lumensAutonomie au plus faible : 110 heuresQuatre intensités lumineuses (7, 100 et 350 lm en éclairage blanc et 4 lm en éclairage rouge/vert/bleu)Mode clignotant en éclairage rouge/vert/bleu (visible à 700 m pendant 300 heures)Vision confortable de près grâce à un faisceau large et homogèneRésistance aux chocs : IK07 (EN/IEC 62262)Résistance aux chutes : 2 m de hauteur (ANSI/PLATO FL 1)Étanchéité à la poussière et à l’eau : norme IP67 (étanche à l'immersion à 1 mètres de profondeur pendant 30 minutes)Livrée avec trois piles alcalines LR03/AAA 1.5V non rechargeablesPeut être également alimentée par une batterie Lithium-Ion Core 3.6V 1250 mAh réf 30.027345 (vendue séparément) rechargeable directement via sa prise USB intégrée (cordon fourni avec la batterie)Témoin lumineux à l'allumage et à l'extinction de la lampe permettant de consulter le niveau de chargeFonction LOCK pour éviter les allumages intempestifs lors du transport / stockageLivrée avec un bandeau élastique ajustable avec boucle d'ouverture rapide pour une mise en place facileMontage possible sur un casque selon modèle grâce aux adaptateurs réf 30.027158 et réf 30.027159 (vendus séparément) Garantie : 5 ans Poids : Poids net : 70 g (sans piles)Poids brut : 105 g (avec piles)Coloris :  Camo CE",Accessoires,,
00cc5155-f7cb-4d1a-8f5b-700a88b169f0,A10,14.099258,,01/12/2022,Lampe frontale rechargeable HM1 - 440 Lumens,https://www.vsmdiffusion.fr/7074-large_default/lampe-frontale-rechargeable-hm1-440-lumens.jpg,"Caractéristiques : Lampe frontale rechargeable à tête pivotante jusqu'à 60° led Cree XPG-3Fabriquée en alliage d'aluminium de qualité aéronautiqueDistance d'éclairage maximale : 100 mIntensité lumineuse maximale : 440 lumensAutonomie minimale : 70 heuresAutonomie maximale : 2,5 heuresTrois intensités lumineuses en éclairage principal blanc (440, 330 et 100 lm)Deux intensités lumineuses en éclairage secondaire blanc (120 et 10 lm)Résistance aux chutes : 2 m de hauteurEtanchéité : norme IPX-6 (résistance aux projections des jets d'eau puissants)Dimensions de la lampe : 60mm x 43mm x 41mmPoids net : 70 g (sans batterie)Poids brut : 95 g (avec batterie)Couleur : noir Rechargement de la lampe par cordon USB non magnétique réf 99299 (fourni)Livrée avec une batterie Lithium-Ion 1800 mAh rechargeable et un bandeau élastique ajustableGarantie : 2 ans",Accessoires,,
86636e06-a1e1-4230-977b-6a2f85570f05,A10,14.099275,,06/01/2024,Lampe tactique compacte rechargeable EC20 LED - 1100 lumens,https://www.vsmdiffusion.fr/13350-large_default/lampe-tactique-compacte-rechargeable-ec20-led-1100-lumens.jpg,"Caractéristiques : Lampe tactique compacte rechargeable avec fonction powerbankDistance d'éclairage maximale : 200 mIntensité lumineuse maximale : 1100 lumensAutonomie minimale : 3,5 heuresAutonomie maximale : 160 heuresTrois intensités lumineuses (10, 300 et 1100 lm)Mode S.O.S. (300 lm)Fabriquée en alliage d'aluminium de qualité aéronautiqueRésistance aux chutes : 1 m de hauteurÉtanchéité : norme IPX-8 (étanche à l'immersion à 2 mètres de profondeur pendant 30 minutes)Livrée avec une batterie intégrée Lithium-Ion 21700 4000 mAh, un cordon de rechargement USB type-C vers USB type-C, un embout prise USB, un embout prise I-Phone et une dragonneGarantie : 1 an Dimensions : Diamètre de la tête 2,8 cm x diamètre du corps 2,8 cm x longueur de la lampe 12 cm Poids :150 g (avec batterie) Coloris :  Noir",Accessoires,,
5867fa72-fae2-4b0e-a7ad-f7453cc84088,A10,14.099256,,01/12/2022,Lampe tactique rechargeable A1 LED - 1100 lumens,https://www.vsmdiffusion.fr/9983-large_default/lampe-tactique-rechargeable-a1-led-1100-lumens.jpg,"Caractéristiques : Lampe tactique led 10W haute performanceFabriquée en alliage d'aluminium de qualité aéronautiqueDistance d'éclairage maximale : 230 mIntensité lumineuse maximale : 1100 lumensAutonomie minimale : 3 heuresAutonomie maximale : 72 heuresTrois intensités lumineuses (30, 200 et 1100 lm)Mode clignotant (1000 lm)Résistance aux chutes : 1 m de hauteurEtanchéité : norme IPX-6 (résistance aux projections des jets d'eau puissants)Brise-vitreRechargement de la lampe par cordon USB non magnétique réf 99299 (fourni)Livrée avec une batterie Lithium-Ion 18650 3.7V 2600 mAh réf 99320, une dragonne et un joint d'étanchéité de rechangeGarantie : 1 an Dimensions : L16 x Diamètre 3,5 cmPoids :Poids brut : 175 g (avec batterie) Coloris :Noir",Accessoires,,
235b9bf1-ba56-4475-8e1a-fe6e9fefc4f9,A10,14.099276,,06/01/2024,Lampe tactique rechargeable A1 PRO LED - 1300 lumens,https://www.vsmdiffusion.fr/13355-large_default/lampe-tactique-rechargeable-a1-pro-led-1300-lumens.jpg,"Caractéristiques : Lampe tactique rechargeable polyvalente avec embout brise-vitreDistance d'éclairage maximale : 230 mIntensité lumineuse maximale : 1300 lumensAutonomie minimale : 3,2 heuresAutonomie maximale : 50 heuresTrois intensités lumineuses (30, 200 et 1300 lm)Mode clignotant (1300 lm)Fabriquée en alliage d'aluminium de qualité aéronautiqueRésistance aux chutes : 1 m de hauteurÉtanchéité : norme IPX-6 (résistance aux projections des jets d'eau puissants)Livrée avec une batterie Lithium-Ion 18650 3.7V 2600 mAh, un cordon de rechargement USB vers USB type-C, une dragonne et un joint d'étanchéité de rechangeGarantie : 1 an Dimensions : Diamètre de la tête 3,5 cm x diamètre du corps 2,7 cm x longueur de la lampe 16 cm Poids :Poids net : 135 g (sans batterie)Poids brut : 185 g (avec batterie) Coloris :  Noir",Accessoires,,
638ea26d-3d87-4f69-8aa6-15bad523e6b2,A10,14.099289,,01/12/2022,Lampe tactique rechargeable AR10 LED - 1080 Lumens,https://www.vsmdiffusion.fr/4400-large_default/lampe-tactique-xt2c-klarus-900-lumens.jpg,"Caractéristiques : Lampe tactique rechargeable led Cree XM-L2 U2 à tête orientable jusqu'à 90° avec clip ceinture Culot aimanté pour stabiliser la lampe lors d'une utilisation mains-libres Distance d'éclairage maximale : 153 m Intensité lumineuse maximale : 1080 lumens Autonomie maximale : 220 heures Quatre intensités lumineuses (10, 150, 450 et 1080 lm) Mode clignotant (1080 lm) et mode S.O.S. (150 lm) Fabriquée en alliage d'aluminium de qualité aéronautique Résistance aux chutes : 1 m de hauteur Etanchéité : norme IPX-8 (étanche à l'immersion à 2 mètres de profondeur pendant 30 minutes) Livrée avec une batterie Lithium-Ion 18650 3.7V 2600 mAh réf 99320 rechargeable par cordon USB non magnétique réf 99299 (fourni) Adaptateur secteur réf 99322 et adaptateur allume-cigare réf 99324 vendus séparément Peut être également alimentée par deux piles Lithium CR123A 3V non rechargeables réf 26590 (vendues séparément) Livrée avec une dragonne, un joint d'étanchéité de rechange et un cordon de chargement USB non magnétique Diamètre de la tête : 2,5 cm Diamètre du corps : 2,4 cm Longueur de la lampe : 14,4 cm Poids net : 100 g (sans batterie) Poids brut : 145 g (avec batterie) Couleur : noir Garantie : 5 ans",Accessoires,,
f05b40fb-46b6-4de9-997a-1c4b1ab63b50,A10,14.099342,,01/12/2022,Lampe tactique rechargeable XT12GT LED - 1600 Lumens,https://www.vsmdiffusion.fr/5117-large_default/lampe-tactique-rechargeable-xt12gt-led-1600-lumens.jpg,"Caractéristiques : Lampe tactique rechargeable led Cree XPH35 HI D4 Distance d'éclairage maximale : 603 m Intensité lumineuse maximale : 1600 lumens Autonomie maximale : 200 heures Quatre intensités lumineuses (10, 100, 400 et 1600 lm) Mode clignotant (1600 lm) et mode S.O.S. (100 lm) Bague de stabilisation amovible pour empêcher la lampe de rouler Fabriquée en alliage d'aluminium de qualité aéronautique Résistance aux chutes : 1 m de hauteur Etanchéité : norme IPX-8 (étanche à l'immersion à 2 mètres de profondeur pendant 30 minutes) Livrée avec une batterie Lithium-Ion 18650 3.6V 3600 mAh réf 99344 Rechargement de la lampe par cordon USB magnétique réf 99361 (fourni) Livrée avec une dragonne, un joint d'étanchéité de rechange et un étui en nylon noir avec attache-mousqueton Fixation pour ceinture/ceinturon (50 mm) et passant M.O.L.L.E. Diamètre de la tête : 4,5 cm Diamètre du corps : 2,5 cm Longueur de la lampe : 16,1 cm Poids net : 155 g (sans batterie) Poids brut : 200 g (avec batterie) Couleur : noir Garantie : 5 ans",Accessoires,,
4a0d64ce-c535-4530-9253-05eafc2bc379,A10,14.099304,,01/12/2022,Lampe tactique XT2C Klarus - 900 Lumens,https://www.vsmdiffusion.fr/3165-large_default/lampe-tactique-xt2c-klarus-900-lumens.jpg,"Caractéristiques : Double interrupteur arrière, utilisation avec une seule main Interrupteur principal tactique avec activation momentanée Le mode stroboscope peut être activé à partir de tous les modes Puissance maximum : 900 Lumens Temps d'utilisation maximum : 190 heures Distance d'éclairage : 190 M LED Cree XM-L2 (U2) avec une durée de vie de 50 000 heures Trois niveaux d'intensité et un mode flash : • 900 Lumens • 256 Lumens • 18 Lumens • Mode strobe 900 Lumens Volts : 3.4V - 8.4V Pile : 2 x CR123A ou 1x 18650 (Vendues séparément) Couleur : Noir Waterproof norme IPX-8 (étanche à l'immersion = 2 M de profondeur pendant 30 minutes) Résistance aux impactes : 1.5 m de hauteur Fabriquée en aluminium aéronautique Dimensions : 135 mm (longueur) x 26.4 mm (diamètre de la tête) x 25 mm (diamètre du corps) Poids net : 81 g (sans batterie) Livré avec clip ceinture, dragonne, joints d'étanchéités de rechange, bouton tactique de rechange Garantie 2 ans",Accessoires,,
872900d9-a156-4ab1-8afb-47a96fa64b38,A10,14.099252,,01/12/2022,Lampe tactique rechargeable XT2CR PRO LED - 2100 Lumens,https://www.vsmdiffusion.fr/9609-large_default/lampe-tactique-rechargeable-xt2cr-pro-led-2100-lumens.jpg,"Fabriquée avec des matériaux de qualité aéronautique résistant à la corrosion, aux chocs et à l'abrasion, la lampe tactique XT2CR PRO est une valeur sûre.Elle se distingue par une puissance d'éclairage de 2100 lumens et une portée maximale de 240 m.La lampe se pilote grâce au double interrupteur de 5ème génération. Intuitif, rapide précis et efficace, vous parcourez les différents modes et les différentes intensités aisément. La lampe XT2CR PRO se recharge via un câble USB de type-C et elle dispose d'un indicateur de niveau de batterie. Il est également possible de connecter directement la lampe à un powerbank. Ce modèle est compatible avec l'allumage déporté 99251Caractéristiques :  Lampe tactique rechargeable led Cree XHP35 HD 6500K avec clip ceinture anti-arrachementDistance d'éclairage maximale : 240 mIntensité lumineuse maximale : 2100 lumensAutonomie minimale : 4 heuresAutonomie maximale : 150 heuresQuatre intensités lumineuses (10, 100, 400 et 2100 lm)Mode clignotant (2100 lm) et mode S.O.S. (100 lm)Fabriquée en alliage d'aluminium de qualité aéronautiqueRésistance aux chutes : 1 m de hauteurEtanchéité : norme IPX-8 (étanche à l'immersion à 2 mètres de profondeur pendant 30 minutes)Rechargement de la lampe par cordon USB non magnétique réf 99299 (fourni)Livrée avec une batterie Lithium-Ion 18650 3.6V 3100 mAh réf 99371, une dragonne, un joint d'étanchéité de rechange et un étui en nylon noir avec attache-mousquetonFixation pour ceinture/ceinturon (50 mm) et passant M.O.L.L.E.Garantie : 5 ansPoids :140 g (avec batterie)Dimensions :Longueur 12,8 x Diamètre 2,8 cm Coloris :  Noir",Accessoires,,
976193eb-2092-452c-8f6d-af4f61627c2a,VANOS,B0853,,18/11/2022,Jeep Alliée avec Canon Anti Aérien M38-B0853,https://www.quaerius.com/34881-large_default/jeep-alliee-avec-canon-anti-aerien-m38-b0853.jpg,,Autres,,
9af979b0-242e-414f-b798-d42a9faac1e5,VANOS,B0302,,18/11/2022,Camion Militaire à Canon Lourd M38-B0302,https://www.quaerius.com/15998-large_default/camion-militaire-a-canon-lourd-m38-b0302-sluban.jpg,"Le Camion Militaire à Canon Lourd M38-B0302 Sluban est un jeu de construction qui représente un véhicule militaire lourd armé d'un canon pour les frappes à distance, avec soldats.",Autres,,
ddbecf86-3287-4c05-b9e3-fc50903dd32d,VANOS,B0891,,18/11/2022,Chasseur Falcon M38-B0891,https://www.quaerius.com/33762-large_default/chasseur-falcon-m38-b0891.jpg,,Autres,,
cdecc134-d4a4-4cf5-9bff-5f35bd5e05e8,VANOS,B0695,,18/11/2022,Camion Militaire Half-track Allemand Désert M38-B0695,https://www.quaerius.com/15800-large_default/camion-militaire-half-track-allemand-desert-m38-b0695-sluban.jpg,"Le Camion Militaire Half-track Allemand Désert M38-B0695 Sluban est un jeu de construction qui représente un camion half-track allemand de la deuxième guerre mondiale, utilisé dans les zones désertiques.",Autres,,
