"ID","FOURNISSEUR_NOM","FOURNISSEUR_REFERENCE","SizesColors","DATE_CREATION","Title","Image","Description","Category","Subcategory","SubSubcategory"
b7076eec-3669-4827-970a-2f1aae6c5857,GK,9860P,,06/02/2024,Bâton télescopique Acier & Aluminium – bouton poussoir,https://gkpro.fr/wp-content/uploads/2023/05/580AL-17-plie-web-600x600.png,"Le bâton télescopique Acier & Aluminium avec bouton poussoir a été créée afin de satisfaire les besoins des agents. L’utilisation est intuitive, rapide et facile : pour déplier le bâton, il suffit d’effectuer un simple geste rapide de l’avant-bras ; pour le rétracter, un système de bouton poussoir permet à l’utilisateur de le replier sans aucun effort. Ce système est également un atout majeur dans un petit espace ou pour ouvrir le bâton discrètement, il suffit de tirer l’extrémité en appuyant sur le bouton. Le grip utilisé sur ce bâton améliore la prise en main et évite les glissements, pour procurer encore plus d’assurance à l’utilisateur. Adapté aux opérations et besoins des Forces de l’ordre, le bâton télescopique Acier & Aluminium avec bouton poussoir répond parfaitement aux exigences du terrain. Compatible avec nos modules lampe et brise-glace, n’hésitez plus ! Les bâtons GK vont rapidement devenir un incontournable des BDT. En trois mots : ergonomique, résistant et tactique. Deux tailles disponibles :   17″ : +/- 41,5 cm (ouvert), +/- 19,5 cm (fermé), 318g (+/- 20g) 21″ : +/- 51,5 cm (ouvert), +/- 22,5 cm (fermé), 370g (+/- 20 g)  Besoin d’avoir un bâton télescopique complet ? Vous pouvez également installer notre module lampe au niveau de votre bouton poussoir et un module brise-glace à son extrémité. Ainsi vous aurez un bâton télescopique pour faire fasse à toutes les situations. CARACTÉRISTIQUES :  Acier et aluminium Diamètre : 28,5 mm Rétractable Equipé d’un bouton poussoir pour libérer ou rétracter le bâton facilement et rapidement Marquage GK sur le devant Poignée grippée  PRODUITS COMPATIBLES : Les éléments compatibles :  #580-LAMP Module lampe #580-BRIS Module brise-glace  Les porte-bâtons compatibles :  #9860P Porte-bâton télescopique pivotant Timecop #4960 Porte-bâton télescopique pivotant Copland #990270 Porte-bâton NEO GK Undercover",Autres,,
1f0bab20-0a56-4c44-a6e2-5d31a070a704,GK,9860PSM-PM,,06/02/2024,Porte-bâton pivotant pour système m.o.l.l.e,https://gkpro.fr/wp-content/uploads/2022/08/9860PSM-PM-FACE-600x600.jpg,"PORTE-BÂTON PIVOTANT POUR SYSTÈME M.O.L.L.E Celui-ci est conçu pour porter et protéger un bâton télescopique de défense (BTD) Sa sangle de serrage à l’avant permet de s’adapter à tous les bâtons télescopiques afin de rendre ce porte-accessoire universel Son ingénieux système pivotant à 180° avec système TURNSTOP avec 5 positions de blocage vous assure une personnalisation de port sans égal. De plus, une ouverture en bas permet de remettre le bâton déplié     INSTRUCTIONS D’ENTRETIEN PORTE-BÂTON PIVOTANT POUR SYSTÈME M.O.L.L.E :  Brosser légèrement Nettoyer avec un chiffon humide Laisser sécher à l’air libre  CARACTERISTIQUES  Sangle de serrage Système pivotant à 180° avec système TURNSTOP avec 5 positions de blocage Ouverture en bas  COMPOSITION  Tissu : Polyamide haute ténacité Bordure : Polyamide haute ténacité Sangle : Polypropylène Fil : Polyamide haute ténacité Renforts plastiques : Polyéthylène Bande auto-agrippante : Polyamide Bouton pression : laiton bronzé (calotte métalloplastique) Pièces métalliques : laiton ou acier traité anticorrosion",Accessoires,,
cb4e589e-a873-40df-bbd6-64e40dc9c680,HELIKON-TEX,MO-P03-CD-11,,21/09/2022,competition-set lato-2021 3-gun-set ipsc-set tactical-set,https://www.helikon-tex.com/media/catalog/product/cache/4/image/265x/9df78eab33525d08d6e5fb8d27136e95/m/o/mo-p03-cd-35.jpeg,,Autres,,
c88e1685-472b-4c0d-942d-cb4e2b128bde,GK,9403.2,,06/02/2024,Porte-chargeur horizontal vertical red label,https://gkpro.fr/wp-content/uploads/2020/01/9403.2-FACE-WEB-600x600.png,"PORTE-CHARGEUR HORIZONTAL VERTICAL RED LABEL La gamme RedLabel, connue pour son design sobre et discret, possède 2 qualités principales :  – Résistance : sa composition en CORDURA® lui confère une résistance extrême à l’abrasion et une très bonne résistance à la chaleur et au feu. De par leur composition les bords et leurs doubles coutures ne se déformeront pas et ne se détérioreront pas dans le temps.  – Modularité : son système de passant breveté lui permet de s’adapter sur différentes tailles de ceintures et/ou ceinturons ainsi que sur d’autres équipements (plaque de cuisse, gilets tactiques, …) Nous avons conçu ce produit afin que 2 types de ports soient possibles : Horizontal et Vertical. Ainsi, le porte-chargeur peut totalement s’adapter à vos besoins et habitudes. De plus, un rabat sécurisant, se fermant par 2 boutons pression, est intégré afin de protéger le chargeur et vous assurer une sécurité optimale. Celui-ci est aussi rigide afin d’éviter toute déformation sous le poids du chargeur contenant des munitions. CARACTERISTIQUES  Porte-chargeur RED LABEL Port horizontal ou vertical Rabat sécurisant avec 2 boutons pressions Pour chargeur de pistolet automatique Compatible avec des ceinturons de 50mm, 40mm et 30mm de largeur  COMPOSITION  Tissu : Polyamide haute ténacité Mousse : Polyéthylène Fil : Polyamide haute ténacité Bordure : Polyamide haute ténacité Sangle : Polypropylène Renforts : Polyéthylène Pressions : Laiton/Plastique Bande auto-agrippante : Polyamide",Accessoires,,
0a966155-a5f5-447a-aabb-f500f2615b89,A10,01.208023,,01/12/2022,Porte-aérosol 100 ml avec poignée SÉCU-ONE noir,https://www.vsmdiffusion.fr/13562-large_default/porte-aerosol-100-ml-avec-poignee-secu-one-noir.jpg,"Car chaque homme de terrain est au cœur de nos préoccupations, A10 Equipment vous propose une collection complète de vêtements, chaussures et accessoires dédiée aux métiers de la Sécurité Privée construite autour de 4 axes : résistance, ergonomie, fonctionnalité et technicité. La gamme SÉCU-ONE a pour objectif de vous proposer le meilleur sans faire de concessions. RÉSISTANCE : Tissu nylon CORDURA hautement résistant à l'abrasion FONCTIONNALITÉ : Fermeture par bouton-pressionFixation par système anti-arrachement pour ceinture/ceinturon (50 mm) COMPOSITION :  100% nylon COLORIS :  Noir DIMENSIONS :  L. 5 x P. 4,5 x H. 18 cm DÉCLINAISONS : Egalement disponible en 25 ml, 50 ml, 75 ml et 100 mlLivré sans accessoires",Accessoires,,
72ea67c0-14af-49e4-a8fa-7bb3f64bb9d2,A10,01.208020,,01/12/2022,Porte-aérosol 25 ml / porte-lampe SÉCU-ONE noir,https://www.vsmdiffusion.fr/13559-large_default/porte-aerosol-25-ml-porte-lampe-secu-one-noir.jpg,"Car chaque homme de terrain est au cœur de nos préoccupations, A10 Equipment vous propose une collection complète de vêtements, chaussures et accessoires dédiée aux métiers de la Sécurité Privée construite autour de 4 axes : résistance, ergonomie, fonctionnalité et technicité. La gamme SÉCU-ONE a pour objectif de vous proposer le meilleur sans faire de concessions. RÉSISTANCE : Tissu nylon CORDURA hautement résistant à l'abrasion FONCTIONNALITÉ : Fermeture par bouton-pressionFixation par système anti-arrachement pour ceinture/ceinturon (50 mm) COMPOSITION :  100% nylon COLORIS :  Noir DIMENSIONS :  L. 4 x P. 3 x H. 14 cm DÉCLINAISONS : Egalement disponible en 50 ml, 75 ml, 100 ml et 100 ml avec poignéeLivré sans accessoires",Accessoires,,
8893852e-de34-46d9-9f98-0e629982a387,A10,37.200309,,01/12/2022,Porte-aérosol anti-agression 300 ml noir,https://www.vsmdiffusion.fr/3365-large_default/porte-aerosol-anti-agression-300-ml-noir.jpg,Caractéristiques :  Tissu CORDURA® 1000 deniers Pour ceinturon jusqu'à 50 mm de large Fermeture bouton-pression 2 positions Bouton-pression de 20mm Ø recouvert de gomme anti-dérapante Fixation par système MOLLE avec passant auto-agrippant et passant anti-arrachement,Accessoires,,
f21c48f2-405f-4dae-a74d-6308aa1785b3,A10,01.208021,,01/12/2022,Porte-aérosol 50 ml / porte-lampe SÉCU-ONE noir,https://www.vsmdiffusion.fr/13560-large_default/porte-aerosol-50-ml-porte-lampe-secu-one-noir.jpg,"Car chaque homme de terrain est au cœur de nos préoccupations, A10 Equipment vous propose une collection complète de vêtements, chaussures et accessoires dédiée aux métiers de la Sécurité Privée construite autour de 4 axes : résistance, ergonomie, fonctionnalité et technicité. La gamme SÉCU-ONE a pour objectif de vous proposer le meilleur sans faire de concessions. RÉSISTANCE : Tissu nylon CORDURA hautement résistant à l'abrasion FONCTIONNALITÉ : Fermeture par bouton-pressionFixation par système anti-arrachement pour ceinture/ceinturon (50 mm) COMPOSITION :  100% nylon COLORIS :  Noir DIMENSIONS :  L. 4,5 x P. 3,5 x H. 15,5 cm DÉCLINAISONS : Egalement disponible en 25 ml, 75 ml, 100 ml et 100 ml avec poignéeLivré sans accessoires",Accessoires,,
d68505d5-f10c-48bf-9f90-156d2c5b5106,A10,37.200307,,01/12/2022,Porte-aérosol anti-agression 500 ml noir,https://www.vsmdiffusion.fr/3366-large_default/porte-aerosol-anti-agression-500-ml-noir.jpg,Caractéristiques :  Tissu CORDURA® 1000 deniers Pour ceinturon jusqu'à 50 mm de large Fermeture bouton-pression 2 positions Bouton-pression de 20mm Ø recouvert de gomme anti-dérapante Fixation par système M.O.L.L.E. avec passant auto-agrippant et anti-arrachement,Accessoires,,
a39ccf2d-889e-4a66-a825-6fde5a9d41d3,A10,01.072266,,17/11/2022,Porte-carte transparent Expédition vert olive,https://www.vsmdiffusion.fr/12062-large_default/porte-carte-transparent-expedition-vert-olive.jpg,"La gamme EXPEDITION se compose de nombreux accessoires indispensables à vos missions et bivouacs. Les points forts de la collection sont la légèreté, l'imperméabilité, la résistance et les fonctionnalités conçues pour une utilisation optimale. Les produits EXPEDITION sont conçus pour minimiser l'encombrement et le poids de votre sac. Le porte-carte EXPEDITION avec fermeture par zip YKK® est à la fois grand, compact et doté de 2 faces transparentes pour une meilleure visibilité de l'itinéraire à suivre. Sa surface en PVC protège vos cartes des intempéries et en fait un accessoire incontournable de vos missions / bivouacs.FONCTIONNALITÉ : Traitement déperlant DWR-TECHOuverture / fermeture par zip YKK®Système de prise en main rapide du zip COMPOSITION : PVCTissu polyester HRF 600D DIMENSIONS :A plat : L. 53 x H. 63 cmPlié : L. 28 x H. 16 cmPOIDS :180 gr COLORIS :  Vert Olive",Accessoires,,
baf35553-351c-4dec-90e9-86402cf5f20b,A10,37.086411,,01/12/2022,Porte-casque,https://www.vsmdiffusion.fr/1282-large_default/porte-casque.jpg,"Caractèristiques : Tissu CORDURA® 1000 deniers,Fermerture bouton-pression Coloris : Noir",Accessoires,,
9ec029f5-67c2-4e39-b6bb-0658e951a450,A10,37.200317,,01/12/2022,Porte-chargeur P.A. double,https://www.vsmdiffusion.fr/763-large_default/porte-chargeur-pa-double.jpg,Caractèristiques : Tissu CORDURA® 1000 deniersPour ceinturon 50 mm de largeFermeture bouton-pression 2 positionsBouton-pression de 20mm Ø recouvert de gomme anti-dérapanteFixation par système M.O.L.L.E. avec passant auto-agrippant et passant anti-arrachement,Accessoires,,
21b91084-ab53-4662-acd3-73d49a2e8907,A10,37.200315,,01/12/2022,Porte-chargeur P.A. simple,https://www.vsmdiffusion.fr/2187-large_default/porte-chargeur-pa-simple.jpg,Caractèristiques : Tissu CORDURA® 1000 deniersPour ceinturon 50 mm de largeBouton-pression de 20mm Ørecouvert de gomme anti-dérapanteFixation par système MOLLEavec passant auto-agrippant etpassant anti-arrachement,Accessoires,,
df31bdb2-7155-48aa-a5be-5744dab0d69e,A10,37.086395,,01/12/2022,Porte-gants noir Cordura,https://www.vsmdiffusion.fr/3186-large_default/porte-gants-noir.jpg,Caractéristiques :Tissu CORDURA® 1000 deniers Se fixe facilement à tout ceinturon par passant résistant également en Cordura® Attache réglable par auto-agrippant,Accessoires,Gants,
cf32e2cc-698b-47bd-9fb7-c5b94bb507e1,A10,01.072253,,18/04/2023,Porte-Képi Transall,https://www.vsmdiffusion.fr/7322-large_default/porte-kepi.jpg,"Caractéristiques : Poignée de transport Compartiment intérieur doublé en feutrine et équipé d'une bande ajustable par auto-agrippant amovible. Miroir intérieur amovible par auto-agrippant Poche extérieur avec zip Dimensions :  L.29,5 x P.22 x H.12cmPoids :  540gr Coloris : Noir, Vert OD ou Tan",Accessoires,,
ebdf87b9-0418-4456-862d-bdd005d2e44a,A10,37.200323,,01/12/2022,Porte-menottes administratives noir,https://www.vsmdiffusion.fr/3670-large_default/porte-menottes-administratives-noir.jpg,Composition : Tissu CORDURA® 1000 deniers Caractéristiques : Pour ceinturon 50 mm de large Bouton-pression 2 positions de 20mm Ø recouvert de gomme anti-dérapante Fixation par système M.O.L.L.E. avec passant auto-agrippant et passant anti-arrachement,Accessoires,,
4b0fb26a-49cf-4773-ba65-59573ed8f5dd,A10,01.072259,,01/10/2022,Portefeuille + Etiquette Transall,https://www.vsmdiffusion.fr/7336-large_default/porte-kepi.jpg,"Caractéristiques : 2 poches extérieures avec zip5 poches intérieures compatibles pour passeport, carte d'indentité, documents militaires, carte bancaire... Velcro intérieur à personnaliser Vendu avec une étiquette bagage à complèter au verso par les informations personnelles  Dimensions :  L.15 x P.1,5 x H.11cmPoids :  100gr Coloris : Noir, Vert OD ou Tan",Accessoires,,
33e490b9-fa61-4d01-99e9-d021ef9c47a0,TREESCO,PHPU001,"3XL/KAKI, 4XL/KAKI, L/KAKI, M/KAKI, S/KAKI, XL/KAKI, XXL/KAKI",05/11/2022,PULL MUNTJAC,https://www.vsmdiffusion.fr/8170-large_default/pull-muntjac.jpg,"Composition : 100 % polyester, intérieur micropolaire 100 % polyester. Caractéristiques : Pull en tissu 2 couches, extérieur tricot.Col montant zippé.2 poches basses zippées. Tailles :   S au 4XL  Coloris :  Kaki/Sagittaire",Vêtements,Hauts,Pulls
dbc84d3e-8033-475d-be36-f75f4c60cba6,TREESCO,LVPU121,"3XL/MARRON, 4XL/MARRON, L/MARRON, M/MARRON, S/MARRON, XL/MARRON, XXL/MARRON",05/11/2022,PULL FOX ROND,https://www.vsmdiffusion.fr/8094-large_default/pull-fox-rond.jpg,Composition : 40 % acrylique 30 % polyamide 30 % laine. Caractéristiques : Pull col rond. Empiècements épaules et coudes contrastés en suédine 100 % polyester. Tailles :   S au 4XL  Coloris :  Marron moyen,Vêtements,Hauts,Pulls
6cc59387-92a8-4f8a-bd06-c1881fc84fbc,TREESCO,LVPU125,"3XL/KAKI, 4XL/KAKI, L/KAKI, M/KAKI, S/KAKI, XL/KAKI, XXL/KAKI, 3XL/MARRON, 4XL/MARRON, L/MARRON, M/MARRON, S/MARRON, XL/MARRON, XXL/MARRON",05/11/2022,PULL FOX ZIPPE,https://www.vsmdiffusion.fr/8096-large_default/pull-fox-zippe.jpg,"Composition : 40 % acrylique, 30 % polyamide, 30 % laine. Caractéristiques : Pull col zippé. Empiècements épaules et coudes contrastés en suédine 100 % polyester. Tailles :   S au 4XL  Coloris :  Marron moyen",Vêtements,Hauts,Pulls
11a57bd7-7454-46bc-8309-04666836169e,A10,01.202146,,06/01/2024,Réchaud à gaz Tac-Boil,https://www.vsmdiffusion.fr/7066-large_default/rechaud-a-gaz-tac-boil.jpg,"Caractéristiques : Doté d'un système d'allumage piézoélectrique et simple d'utilisation, le réchaud à gaz TAC-BOIL est idéal pour une utilisation lors de tous vos bivouacs tactiques. Il est doté d'une valve de réglage pour un contrôle précis de l'ébullition. Les supports dentelés contribuent à stabiliser le récipient. La valve de réglage et les supports dentelés se replient le long du brûleur pour faciliter son rangement. Le sac de transport en polyester avec cordon de serrage permet de protéger efficacement le réchaud pendant le déplacement. Son utilisation est recommandée avec le trépied stabilisateur, le parevent et les récipients la gamme TAC-BOIL. Matériaux : acier inoxydable, aluminium, cuivreSystème d'allumage: piézoélectriqueType de combustible: gaz butane / propaneType de cartouches: cartouches de gaz butane / propane à valve filetée et conformes à la norme EN417Puissance: 229 g/h / 3 300 WAutonomie: avec une cartouche de gaz de 100 g = 31 min, 230 g = 65 min, 450 g = 127 minEncombrement en transport?: diamètre 5,3 x H. 7,2 cmTaille dépliée?: diamètre 10,7 x H. 8,5 cmPoids total sans la cartouche de gaz : 85 g Garantie 1 anConforme à la norme CELivré sans cartouche de gazUsage extérieur uniquementConseils d'entretien : nettoyage avec une éponge ou un chiffon doux, non abrasifNe pas mettre au lave-vaisselle",Autres,,
3bf33b98-ae3d-48a0-bd28-6c665377fd46,HIGHLANDER,BP001,,15/11/2023,Large Webbing Backpack,https://cdn.shopify.com/s/files/1/0618/6264/1948/products/BP001-BE-01.jpg?v=1679402591,"Made from washed canvas, the Large Webbing Backpack has a classic design and looks good anywhere, from the forests of Glentress to the streets of Edinburgh. With a large main compartment, you have plenty of room for your daily essentials, and adjustable shoulder strap make¬†the Large Webbing Backpack comfortable to carry with you wherever your day takes you.",Accessoires,Sacs,
e3e6592a-6c08-4c64-a021-b9ba42c35bec,HELIKON-TEX,BL-RHF-PO-010CA,"3XL/MULTICAM, L/MULTICAM, M/MULTICAM, S/MULTICAM, XL/MULTICAM, XS/MULTICAM, XXL/MULTICAM",13/09/2022,SummerSale,https://www.helikon-tex.com/media/catalog/product/cache/4/image/265x/9df78eab33525d08d6e5fb8d27136e95/b/l/bl-rhf-po-0162a.jpeg,,Autres,,
9eb444ff-cef8-44d5-b9a6-8fca2984d88d,HIGHLANDER,ACC034,,05/10/2023,"Sl Military Hydration Bladder, 2L",https://cdn.shopify.com/s/files/1/0618/6264/1948/files/ACC034-OG.jpg?v=1705666474,"Stay hydrated on the move with the 2 litre premium hydration bladder with Microban to protect against bacteria. Fits neatly into most packs with the hose clipping onto your shoulder strap. No need to stop and unpack bottles, drink from the straw and keep moving.",Autres,,
1718dc1b-e461-4738-a796-8056762b4e4c,HIGHLANDER,ACC035,,05/10/2023,"Sl Military Hydration Bladder, 3L",https://cdn.shopify.com/s/files/1/0618/6264/1948/files/ACC035-OG.jpg?v=1705666500,"Stay hydrated on the move with the¬†3 litre premium hydration bladder with Microban to protect against bacteria..¬†Fits neatly into most packs with the hose clipping onto your shoulder strap. No need to stop and unpack bottles, drink from the straw and keep moving.",Autres,,
54adcce7-fd9a-4412-b9f5-56e9fd3ebca0,MP-SEC,SNU-SCSE3,,16/11/2022,Softie Elite 3 (-5°/-10°),https://www.catalogue.mp-sec.fr/media/catalog/product/cache/2/image/9df78eab33525d08d6e5fb8d27136e95/d/u/duvet-softie-elite-3.jpg,Sac de couchage sarcophage léger et flexible parfaitement adapté pour une utilisation polyvalente grâce à son panneau d'expansion intégré permettant d'augmenter le volume interne du duvet. Vous pourrez ainsi contrôler la température et le confort du duvet avec ce soufflet d'extension. La présence de clips au pied du duvet offre la possibilité de réduire la longueur de 220 cm à 175 cm. Ce clip permet aussi de le suspendre pour l'aérer par exemple. Le fond du sac est renforcé en polyester afin de dormir avec les chaussures.,Autres,,
3775ae70-6417-4e42-9be0-f31100f685cf,MP-SEC,SNU-SCSE4,,16/11/2022,Softie Elite 4 (-10°/-15°),https://www.catalogue.mp-sec.fr/media/catalog/product/cache/2/image/9df78eab33525d08d6e5fb8d27136e95/d/u/duvet-softie-elite-4.jpg,Sac de couchage sarcophage flexible pour les basses températures en dessous de 0 °C parfaitement adapté grâce à son panneau d'expansion intégré permettant d'augmenter le volume interne du duvet. Vous pourrez ainsi contrôler la température et le confort du duvet avec ce soufflet d'extension. La présence de clips au pied du duvet offre la possibilité de réduire la longueur de 220 cm à 175 cm. Ce clip permet aussi de le suspendre pour l'aérer par exemple. Le fond du sac est renforcé en polyester afin de dormir avec les chaussures.,Autres,,
c7d68df4-ae91-40b3-a634-00d4a4f488f6,MP-SEC,SNU-SCSE5,,17/11/2022,Softie Elite 5 (-15°/-20°),https://www.catalogue.mp-sec.fr/media/catalog/product/cache/2/image/9df78eab33525d08d6e5fb8d27136e95/d/u/duvet-softie-elite-5.jpg,Sac de couchage sarcophage flexible pour les basses températures en dessous de 0°c parfaitement adapté grâce à son panneau d'expansion intégré permettant d'augmenter le volume interne du duvet. Vous pourrez ainsi contrôler la température et le confort du duvet avec ce soufflet d'extension. La présence de clips au pied du duvet offre la possibilité de réduire la longueur de 220 cm à 175 cm.,Autres,,
75218eb1-e407-4ba1-a248-f2b5c27671fd,MP-SEC,SNU-SCJB,,16/11/2022,Jungle Bag (7°/2°),https://www.catalogue.mp-sec.fr/media/catalog/product/cache/2/image/9df78eab33525d08d6e5fb8d27136e95/j/u/jungle-bag-3.jpg,"Sac de couchage léger avec une moustiquaire pour vous protéger des insectes piqueurs. Son garnissage en Travelsoft lui procure une bonne respirabilité et une bonne évacuation de l'humidité sans avoir besoin d'ouvrir le sac entièrement, une solution idéale sous les tropiques quand il fait chaud et humide. Totalement ouvert, il devient polyvalent grâce à sa forme carrée qui le transforme en couette ou en couverture d'appoint pour les zones tempérées.",Accessoires,Sacs,
34bb2fc4-5a2c-43e2-b3d8-13cb797fc245,A10,01.072247,"L/KAKI, L/NOIR, L/TAN",29/09/2022,Sac de voyage 45L Transall,https://www.vsmdiffusion.fr/7307-large_default/sac-de-transport-90l.jpg,"Caractéristiques : Fond du sac renforcé 2 options de portabe : port main ou port sac à dos Bandoulière amovible et réglable 2 anses de transport avec patte de maintien à scratch. Grand compartiment central 2 compartiments latéraux dont un compartiment range-chaussures 2 poches latérales avec zip 3 poches intérieures avec zip en mesh Transport sécurisé gràce à un anneau de fermeture pour cadenas Vendu avec un étiquette bagage à complèter au verso par les informations personnelles Dimensions :  L.55 x P.29 x H.27cmPoids :  1kg Coloris : Noir, Vert OD ou Tan",Accessoires,Sacs,
9d951a8b-d8b9-49eb-953c-53f3a090dfbf,A10,01.072244,"L/KAKI, L/NOIR, L/TAN",29/09/2022,Sac de transport 90L Transall,https://www.vsmdiffusion.fr/7230-large_default/sac-de-transport-90l.jpg,"Caractéristiques : Fond du sac renforcé 2 options de portabe : port main ou port sac à dos Confort de portable : Bretelles réglables et rembourrées, peuvent être rangées dans leur compartiment respecif. Dos rembourré Sangle pectorale réglable 2 poignées sur les cotés 2 anses de trasport avec patte de maintien à scratch. Spacieux compartiment central 2 compartiments latéraux dont un compartiment ranger-chaussures 4 poches latérales avec zip 3 poches intérieures en mesh Transport sécurisé gràce à un anneau de fermeture pour cadenas Vendu avec un étiquette bagage à complèter au verso par les informations personnelles Dimensions :  L.71 x P.35 x H.36cmPoids :  1,8kg Coloris : Noir, Vert OD ou Tan",Accessoires,Sacs,
e2d76e11-fa18-490e-8ddb-3f556e300e1a,HIGHLANDER,RUC256,,03/11/2023,"Cargo Holdall Bag, 30L",https://cdn.shopify.com/s/files/1/0618/6264/1948/products/RUC256-DE_fd0936ed-579a-46a3-9213-43f6916c29f5.jpg?v=1670847453,"Our Cargo Holdall Bag is a spacious bag ready for city travel. It can handle a few knocks on the way, with extra tough 600D fabric protecting your gear. Plus grab handles and a shoulder strap make it comfortable to carry on and off transport.",Accessoires,Sacs,
c252c408-11d9-4ac2-9172-307431e7b873,HIGHLANDER,DB123,,05/10/2023,"Storm Kitbag Duffle, 30L",https://cdn.shopify.com/s/files/1/0618/6264/1948/files/DB121-OE-FRONT.jpg?v=1719842174,"The Storm Duffle is a spacious, highly practical and incredibly tough Kitbag. This bag will handle any rough treatment, with its rugged, water-resistant PVC outer and tough strap webbing. The spacious main compartment is perfect for stowing your adventure kit and the zips are lockable for your security and peace of mind. When you're loading on and off transport, side grab handles help you stow your kitbag safely, and the padded rucksack-style shoulder straps make it comfortable to carry on the move. The Storm is the ideal kitbag for adventures in the wilds or city exploring. DURABLE - The weather resistant tarpaulin construction and webbing handles make the Storm a ruggedly formidable bag to keep any gear safe and dry in.CARRY ON (AND OFF!) - Padded, removable rucksack-cut straps, webbing carry handles and four external grab handles make moving around and getting on and off transport quick and easy.ROOM FOR (ALMOST) EVERYTHING - The Storm has a spacious main single compartment with a lockable zip, two mesh pockets under the lid, one side zipped pocket and multiple daisy chain attachment points on the outside.EASY ACCESS - A large D-shaped zipper give easy access to the whole main compartment.",Accessoires,Sacs,
